<?xml version="1.0" encoding="UTF-8"?>
<mc:Project xmlns:xsi="http://www.w3.org/2001/XMLSchema-instance"
		 xsi:schemaLocation="urn:musicCollection schema.xsd" 
		 xmlns:mc="urn:musicCollection">
	<Head>
		<Author index="210278">
			<Name> Paweł </Name>
			<Surname> Młynarczyk </Surname>  
		</Author>
		<Author index="210245">
			<Name> Mateusz </Name>
			<Surname> Kuźniarek </Surname>   
		</Author>
		<Title> Kolekcja Albumów Muzycznych </Title>
	</Head>
	<Collection>
		<Albums>
			<Album idArtist="A12" idGenre="G18">
				<Title> 10,000 Days </Title>
				<NumberOfTracks> 11 </NumberOfTracks>
				<Length> 01:15:52 </Length>
				<ReleaseDate> 2006-04-28 </ReleaseDate>
			</Album>
			<Album idArtist="A10" idGenre="G11 G14">
				<Title> .5: The Gray Chapter </Title>
				<NumberOfTracks> 14 </NumberOfTracks>
				<Length> 01:03:51 </Length>
				<ReleaseDate> 2014-10-17 </ReleaseDate>
			</Album>
			<Album idArtist="A12" idGenre="G1 G18">
				<Title> Aenima </Title>
				<NumberOfTracks> 15 </NumberOfTracks>
				<Length> 01:17:18 </Length>
				<ReleaseDate> 1996-09-17 </ReleaseDate>
			</Album>
			<Album idArtist="A10" idGenre="G9">
				<Title> All Hope Is Gone </Title>
				<NumberOfTracks> 12 </NumberOfTracks>
				<Length> 00:57:57 </Length>
				<ReleaseDate> 2008-08-20 </ReleaseDate>
			</Album>
			<Album idArtist="A5" idGenre="G10 G7 G19">
				<Title> Anthem Of The Peaceful Army </Title>
				<NumberOfTracks> 10 </NumberOfTracks>
				<Length> 00:45:53 </Length>
				<ReleaseDate> 2018-10-19 </ReleaseDate>
			</Album>
			<Album idArtist="A2" idGenre="G6">
				<Title> The Apostasy </Title>
				<NumberOfTracks> 13 </NumberOfTracks>
				<Length> 00:39:39 </Length>
				<ReleaseDate> 2007-07-17 </ReleaseDate>
			</Album>
			<Album idArtist="A1" idGenre="G11">
				<Title> Avatar Country </Title>
				<NumberOfTracks> 10 </NumberOfTracks>
				<Length> 00:43:18 </Length>
				<ReleaseDate> 2018-01-12 </ReleaseDate>
			</Album>
			<Album idArtist="A9" idGenre="G16 G11">
				<Title> Bible Of The Beast </Title>
				<NumberOfTracks> 12 </NumberOfTracks>
				<Length> 00:47:36 </Length>
				<ReleaseDate> 2009-04-24 </ReleaseDate>
			</Album>
			<Album idArtist="A3" idGenre="G11">
				<Title> Black Sabbath </Title>
				<NumberOfTracks> 7 </NumberOfTracks>
				<Length> 00:38:12 </Length>
				<ReleaseDate> 1970-02-13 </ReleaseDate>
			</Album>
			<Album idArtist="A1" idGenre="G9 G13 G4 G12">
				<Title> Black Waltz </Title>
				<NumberOfTracks> 11 </NumberOfTracks>
				<Length> 00:54:48 </Length>
				<ReleaseDate> 2012-01-25 </ReleaseDate>
			</Album>
			<Album idArtist="A9" idGenre="G16 G20">
				<Title> Blessed &amp; Possessed </Title>
				<NumberOfTracks> 11 </NumberOfTracks>
				<Length> 00:45:42 </Length>
				<ReleaseDate> 2015-07-17 </ReleaseDate>
			</Album>
			<Album idArtist="A9" idGenre="G16 G11">
				<Title> Blood Of The Saints </Title>
				<NumberOfTracks> 11 </NumberOfTracks>
				<Length> 00:41:46 </Length>
				<ReleaseDate> 2011-07-29 </ReleaseDate>
			</Album>
			<Album idArtist="A6" idGenre="G11">
				<Title> The Book Of Souls </Title>
				<NumberOfTracks> 11 </NumberOfTracks>
				<Length> 01:32:11 </Length>
				<ReleaseDate> 2015-09-04 </ReleaseDate>
			</Album>
			<Album idArtist="A3" idGenre="G11">
				<Title> Born Again </Title>
				<NumberOfTracks> 9 </NumberOfTracks>
				<Length> 00:41:04 </Length>
				<ReleaseDate> 1983-08-07 </ReleaseDate>
			</Album>
			<Album idArtist="A6" idGenre="G11">
				<Title> Brave New World </Title>
				<NumberOfTracks> 10 </NumberOfTracks>
				<Length> 01:06:57 </Length>
				<ReleaseDate> 2000-05-29 </ReleaseDate>
			</Album>
			<Album idArtist="A3" idGenre="G11">
				<Title> Cross Purposes </Title>
				<NumberOfTracks> 11 </NumberOfTracks>
				<Length> 00:47:27 </Length>
				<ReleaseDate> 1994-01-26 </ReleaseDate>
			</Album>
			<Album idArtist="A8" idGenre="G19 G15 G10">
				<Title> Eat The Elephant </Title>
				<NumberOfTracks> 12 </NumberOfTracks>
				<Length> 00:57:07 </Length>
				<ReleaseDate> 2018-04-20 </ReleaseDate>
			</Album>
			<Album idArtist="A8" idGenre="G2 G3">
				<Title> eMOTIVe </Title>
				<NumberOfTracks> 12 </NumberOfTracks>
				<Length> 00:48:13 </Length>
				<ReleaseDate> 2004-11-01 </ReleaseDate>
			</Album>
			<Album idArtist="A3" idGenre="G11">
				<Title> The Eternal Idol </Title>
				<NumberOfTracks> 9 </NumberOfTracks>
				<Length> 00:42:42 </Length>
				<ReleaseDate> 1987-11-23 </ReleaseDate>
			</Album>
			<Album idArtist="A2" idGenre="G6 G17 G21">
				<Title> Evangelion </Title>
				<NumberOfTracks> 10 </NumberOfTracks>
				<Length> 00:41:54 </Length>
				<ReleaseDate> 2009-08-07 </ReleaseDate>
			</Album>
			<Album idArtist="A7" idGenre="G5">
				<Title> Exercises In Futility </Title>
				<NumberOfTracks> 6 </NumberOfTracks>
				<Length> 00:42:12 </Length>
				<ReleaseDate> 2015-09-04 </ReleaseDate>
			</Album>
			<Album idArtist="A6" idGenre="G11">
				<Title> Fear Of The Dark </Title>
				<NumberOfTracks> 12 </NumberOfTracks>
				<Length> 00:57:58 </Length>
				<ReleaseDate> 1992-05-11 </ReleaseDate>
			</Album>
			<Album idArtist="A1" idGenre="G9 G13 G4 G11">
				<Title> Feathers &amp; Flesh </Title>
				<NumberOfTracks> 14 </NumberOfTracks>
				<Length> 01:07:51 </Length>
				<ReleaseDate> 2016-05-13 </ReleaseDate>
			</Album>
			<Album idArtist="A5" idGenre="G10 G7">
				<Title> From The Fires </Title>
				<NumberOfTracks> 8 </NumberOfTracks>
				<Length> 00:32:15 </Length>
				<ReleaseDate> 2017-11-10 </ReleaseDate>
			</Album>
			<Album idArtist="A1" idGenre="G9 G13 G12 G18">
				<Title> Hail The Apocalypse </Title>
				<NumberOfTracks> 12 </NumberOfTracks>
				<Length> 00:50:52 </Length>
				<ReleaseDate> 2014-05-13 </ReleaseDate>
			</Album>
			<Album idArtist="A3" idGenre="G11 G8">
				<Title> Headless Cross </Title>
				<NumberOfTracks> 9 </NumberOfTracks>
				<Length> 00:40:24 </Length>
				<ReleaseDate> 1989-04-24 </ReleaseDate>
			</Album>
			<Album idArtist="A3" idGenre="G11">
				<Title> Heaven And Hell </Title>
				<NumberOfTracks> 8 </NumberOfTracks>
				<Length> 00:39:46 </Length>
				<ReleaseDate> 1980-04-25 </ReleaseDate>
			</Album>
			<Album idArtist="A11" idGenre="G11 G10">
				<Title> Hypnotize </Title>
				<NumberOfTracks> 12 </NumberOfTracks>
				<Length> 00:39:40 </Length>
				<ReleaseDate> 2005-11-22 </ReleaseDate>
			</Album>
			<Album idArtist="A2" idGenre="G6 G17 G21">
				<Title> I Loved You At Your Darkest </Title>
				<NumberOfTracks> 13 </NumberOfTracks>
				<Length> 00:46:32 </Length>
				<ReleaseDate> 2018-10-05 </ReleaseDate>
			</Album>
			<Album idArtist="A4" idGenre="G11 G8">
				<Title> If You Have Ghost </Title>
				<NumberOfTracks> 5 </NumberOfTracks>
				<Length> 00:24:41 </Length>
				<ReleaseDate> 2013-11-20 </ReleaseDate>
			</Album>
			<Album idArtist="A4" idGenre="G11 G8 G19">
				<Title> Infestissumam </Title>
				<NumberOfTracks> 10 </NumberOfTracks>
				<Length> 00:47:47 </Length>
				<ReleaseDate> 2013-04-10 </ReleaseDate>
			</Album>
			<Album idArtist="A10" idGenre="G14">
				<Title> Iowa </Title>
				<NumberOfTracks> 14 </NumberOfTracks>
				<Length> 01:06:19 </Length>
				<ReleaseDate> 2001-08-28 </ReleaseDate>
			</Album>
			<Album idArtist="A12" idGenre="G18 G19">
				<Title> Lateralus </Title>
				<NumberOfTracks> 13 </NumberOfTracks>
				<Length> 01:18:56 </Length>
				<ReleaseDate> 2001-05-15 </ReleaseDate>
			</Album>
			<Album idArtist="A9" idGenre="G16 G11">
				<Title> Lupus Dei </Title>
				<NumberOfTracks> 11 </NumberOfTracks>
				<Length> 00:43:31 </Length>
				<ReleaseDate> 2007-05-07 </ReleaseDate>
			</Album>
			<Album idArtist="A3" idGenre="G11">
				<Title> Master Of Reality </Title>
				<NumberOfTracks> 8 </NumberOfTracks>
				<Length> 00:34:29 </Length>
				<ReleaseDate> 1971-07-21 </ReleaseDate>
			</Album>
			<Album idArtist="A6" idGenre="G11">
				<Title> A Matter Of Life And Death </Title>
				<NumberOfTracks> 10 </NumberOfTracks>
				<Length> 01:11:53 </Length>
				<ReleaseDate> 2006-08-25 </ReleaseDate>
			</Album>
			<Album idArtist="A4" idGenre="G11 G8 G19 G10">
				<Title> Meliora </Title>
				<NumberOfTracks> 10 </NumberOfTracks>
				<Length> 00:41:35 </Length>
				<ReleaseDate> 2015-08-21 </ReleaseDate>
			</Album>
			<Album idArtist="A8" idGenre="G1 G2 G10 G19 G3">
				<Title> Mer De Noms </Title>
				<NumberOfTracks> 12 </NumberOfTracks>
				<Length> 00:44:25 </Length>
				<ReleaseDate> 2000-05-23 </ReleaseDate>
			</Album>
			<Album idArtist="A11" idGenre="G14">
				<Title> Mezmerize </Title>
				<NumberOfTracks> 11 </NumberOfTracks>
				<Length> 00:36:06 </Length>
				<ReleaseDate> 2005-05-17 </ReleaseDate>
			</Album>
			<Album idArtist="A3" idGenre="G11">
				<Title> Mob Rules </Title>
				<NumberOfTracks> 9 </NumberOfTracks>
				<Length> 00:40:25 </Length>
				<ReleaseDate> 1981-11-04 </ReleaseDate>
			</Album>
			<Album idArtist="A6" idGenre="G11">
				<Title> The Number Of The Beast </Title>
				<NumberOfTracks> 9 </NumberOfTracks>
				<Length> 00:44:39 </Length>
				<ReleaseDate> 1982-03-22 </ReleaseDate>
			</Album>
			<Album idArtist="A4" idGenre="G11 G8 G10">
				<Title> Opus Eponymous </Title>
				<NumberOfTracks> 9 </NumberOfTracks>
				<Length> 00:34:41 </Length>
				<ReleaseDate> 2010-10-18 </ReleaseDate>
			</Album>
			<Album idArtist="A3" idGenre="G11">
				<Title> Paranoid </Title>
				<NumberOfTracks> 8 </NumberOfTracks>
				<Length> 00:41:51 </Length>
				<ReleaseDate> 1970-09-18 </ReleaseDate>
			</Album>
			<Album idArtist="A6" idGenre="G11">
				<Title> Piece Of Mind </Title>
				<NumberOfTracks> 9 </NumberOfTracks>
				<Length> 00:45:18 </Length>
				<ReleaseDate> 1983-05-16 </ReleaseDate>
			</Album>
			<Album idArtist="A4" idGenre="G11 G8 G10 G19">
				<Title> Popestar </Title>
				<NumberOfTracks> 5 </NumberOfTracks>
				<Length> 00:23:37 </Length>
				<ReleaseDate> 2016-09-16 </ReleaseDate>
			</Album>
			<Album idArtist="A6" idGenre="G11">
				<Title> Powerslave </Title>
				<NumberOfTracks> 8 </NumberOfTracks>